,Names,Cause,State,Description,Phone,Address,Email,URL
165,Association for Non-traditional Employment for Women (ANEW),livelihoods,Tamil Nadu,"ANEW - Association for Non-traditional Employment for Women, based in Anna Nagar, Chennai, is an NGO committed to the cause of upliftment of underprivileged women.Young, underprivileged women are selected and trained so that they can become financially independent. They have trained over 9500 candidates since the inception and currently train around 900 candidates per annum. The training courses include: Auto/Car driving, Home nursing (co-certified by Sundaram Medical Foundation), Basic Computer Applications (co-certified by NIIT Foundation), Basic IT program customised for hearing impaired (co-certified by NIIT Foundation), Desk Top Publishing Applications (co-certified by NIIT Foundation), TALLY & Accounting (co-certified by Veetech software solutions), Web Designing (co-certified by NIIT Foundation), Optometry (co-certified by Sight Care Foundation).All their courses have mandatory spoken English and counselling classes to improve their scope of employability. Internships are provided whenever there are corporate opportunities available.""Sponsor computer training for underprivileged girls",+91 44 26210492,"16/107, AH Block, 4th Street,  Shanthi Colony,  Anna Nagar, Chennai 600040 Tamilnadu",anew@anewindia.org,https://www.giveindia.org/nonprofit/association-for-non-traditional-employment-for-women-anew
166,Sense International (India),differently abled,Gujarat,"Sense International (India)'s vision is of a world in which all deafblind children and adults can be full and active members of society.In 1997, when Sense International India first started its work, there was only one deaf-blind service in the country reaching out to just 23 children. But in the last two decades we have succeeded in reaching out to more than 77, 500 deafblind people and their families through a network of 59 partners across 22 states.Akhil S. Paul is the Director and Founder member of Sense International India. He is the Former Vice President of Deafblind International (DBI), a world association promoting services for deafblind people. He is also the Founder Member of the Board of the National Trust for Welfare of People with Autism, Cerebral Palsy, Mental Retardation and Multiple disabilities. He is also the recipient of HSBC- Indo British Award - 2003 for outstanding services to deafblind people in India. He has also received the Young Leader Award in the Community Service and Social Upliftment category at the prestigious Lakshmipat Singhania - IIM Lucknow National Leadership Awards.Total Receipts for 2016-2017 - INR 76424415Total Payments for 2016-2017 - INR 73272282No. of deafblind people provided with need based educational and rehabilitation services, with an increased awareness about deaf-blind - 157No. of deafblind people impacted - 2100No. of deafblind people being provided with need-based early intervention; hospital based neonatal hearing screening of babies - 37No. of deafblind people impacted - 317No. of deafblind people impacted by strengthening of Regional Learning Centre (RLC) & Early Intervention centres - 2180No. of children impacted - 12No. of deafblind people impacted - 62No. of deafblind people impacted - 40No. of deafblind children impacted - 66Rewards & RecognitionIn 2017, Sense International India was awarded the Gujarat NGO Leadership Awards by the World CSR Day & World Sustainability Forum Development of Individuals with deafblindnessIn 2017, Sense International India was awarded the Great Non- profits Top- Rated Awards by the Great Non- profits Top- Rated Development of Individuals with deafblindnessIn 2016, Sense International India was awarded the Accredited by the Indian Institute of Corporate Affairs (IICA) Development of Individuals with deafblindnessIn 2016, Sense International India was awarded the Gold Certification by the GuideStar India Development of Individuals with deafblindnessPart sponsor a mentor to train special educatorsSupport the expenses of a teacher training in Deafblindness",+91 07926301282,"2nd Floor Admin Block, Andhajan Mandal Campus,Opp. Indian Institute of Management (IIM), Vastrapur, Ahmedabad 380015",iarbaaz@senseintindia.org,https://www.giveindia.org/nonprofit/sense-international-india
167,"Cheshire Homes India, Bangalore Unit",differently abled,Karnataka,"Cheshire Homes India, Bangalore Unit works to bring meaningful changes in the lives of people with disabilities. To achieve this, they run two Homes - one that provides educational and residential facilities to more than 25 differently abled girls, and the other that provides love, care, and security to elderly/differently abled women. The girls are given educational support along with skills training, which helps them become more confident and independent. The elderly residents are given adequate medical care and residential support. Apart from this, Cheshire Homes also provides training in Basic Computer Skills, English Language, and Life Skills, after which the students are provided support for placements. Cheshire Homes has helped change the lives of so many people. With the aim to carry forward Group Captain Leonard Cheshire's mission to provide care and support people with disabilities, Cheshire Home India, Bangalore Unit was begun in 1961.Free residential facilities in a beautiful old-fashioned cottage in a serene and tranquil environment are provided for the residents. The residents thrive with this wonderful quality of life, nutritious and healthy food and an environment filled with residents alike. The management of the Home is in the hands of the able sisters of Daughters of Charity. The sisters display a commendable spirit of energy, commitment, and perseverance. Be it coaxing an elderly to eat, or giving their shoulders when some of the residents want to let go their depression or taking a firm stand when they need to be - the sisters play their role to the exception.The home aims to build a society in which every differently abled person can enjoy their rights and has the opportunity to fulfil their potential.", +91 9008440599,"Opp. Manipal Hospital,Bangalore 560017 Karnataka",lathamala@gmail.com,https://www.giveindia.org/nonprofit/cheshire-homes-india-bangalore-unit
168,Centre for Community Initiative (CCI),differently abled,Manipur,"Centre for Community Initiative (CCI) is a non-governmental, non-political, and non-profit organization started in 2002 and restructured in 2007 to deal with various issues to provide a better society through community initiative and participation for the welfare of society and in particular, to persons with special needs.CCI involves mapping a positive and supportive environment for persons with disabilities, encourages inclusive education and advocates for their rights and dignity. It shares, listens, commits and works towards building a responsive society in which persons with disabilities explore their potential and grow in self-esteem to enjoy full participation in the community by facilitating and empowering parents, siblings and persons with disabilities through practical support, assessment, and counseling.With the vision of building a healthy and a just society with equal opportunities for all, CCI has expanded its focus area and work towards the upliftment of the marginalised communities through different livelihood and sustainable development programmes.Persons with Disabilities (PwDs) have long been removed from the mainstream, without any services, care, or attention in the district of Churachandpur, Manipur. This taboo has been culturally internalized and accepted into the social structure, oppressing PwDs regardless of their various abilities.The ""Malsawm Ability Resource Centre (MARC)"" envisions the facilitation of capacities to meet the needs of persons with disabilities in the region. The MARC sees itself in a position as all in one plate-form which may help persons with disabilities (PwDs) to enable their abilities to enjoy a dignified life. Services provided under MARC:The Malsawm Initiative (A School for Children with Special Needs)/TMI is a school where crossed disability students are provided a space where they can enhance their ability to reach their full potential in life. Early Intervention Centre (EIC) under Malsawm Ability Resource Centre (MARC) is working with 0-10 years old children with crossed disabilities who had no prior access to services. Equipped with necessary professionals, the centre provides appropriate services.Malsawm Skill Development & Vocational Rehabilitation Unit was started as Life Skill training as part of students curriculum and slowly changed to Skill Development program to cater adult students with own source.Therapeutic Services Unit for children from the above mentioned interventions and other PwDs where they are provided therapeutic services as needed.Centre for Community Initiative",+69098590429,"Nehru Marg, Central Lamka, Lamka, Churachandpur, Manipur - 795128",info@communityinitiative.in; pausuanlal@communityinitiative.in,https://www.giveindia.org/nonprofit/centre-for-community-initiative-cci
169,Bethany Society,education,Meghalaya,"Bethany Society started in 1981 in Mendal, East Garo Hills, Meghalaya, India. It was started under the vision and inspiring leadership of Sister Rosario Lopez.  Their dream is of an earth fully alive, wherein everyone enjoys the fullness of being.  They work towards this by forming partnerships with people, communities, and resources. This helps create opportunities which empower, enhance dignity, include and lead to the security of health, nutrition, livelihoods and shelter in a sustainable manner.  They work with people in vulnerable situations. They could be persons with disabilities, children, youth and women. They also support people living in extreme poverty, particularly those residing in remote rural areas.  They work in the Northeast region of India and the major focus of interventions in Meghalaya.  Their strategy is: To organize programs on disability which are inclusive, barrier free and rights based. They do this using the Community Based Rehabilitation (CBR) approach. To create sustainable livelihoods and promote micro-enterprises, particularly among rural communities. They do this through the application of appropriate technology. They have startergized so as to promote an attitude of stewardship towards the earth and to create and join networks for greater impact.  They value transparency, excellence, collaboration, interdependence and networking in furtherance of our dream.childrenShillongPart sponsor accommodation of a poor child$ 14.62",+8840976141,"Lady Veronica Lane, Laitumkhrah, Shillong, East Khasi Hills, Meghalaya, 793003",dprakarsh307@gmail.com,https://www.giveindia.org/nonprofit/bethany-society
170,EKAM Foundation,health,Tamil Nadu,"The foundation of EKAM Foundation lies in the belief that every child has the freedom to live and none should be denied the right to healthcare. Thus, they are committed to the healthcare of neonates, children, adolescents, and mothers from underprivileged communities. Their primary focus is on rural health and they aim to achieve this through direct medical support and indirectly through community awareness, empowerment, and participation.  EKAM intervenes to bring a desired positive impact on the overall life-saving scenario by providing support and enhancing their health through several initiatives. They supplement care at primary health centers, district hospitals, and other tertiary care government hospitals by training nurses, helping in maintaining critical equipment, transporting sick infants to the nearest district hospitals, providing lab test support, drugs and medicines in select government hospitals. In addition to this, several camps, training programs, empowerment workshops are organized to create awareness among adolescent girls, expectant mothers, and the community. Their mission is to complete the government health system and not replace it. As of last year, EKAM has reached out to over 1.08 million children and as many families through its multi-pronged initiatives.Support the treatment of a baby at risk Jayalakshmipuram 1st Street,  Chennai 600034 Tamilnadu",+91 44 42072785,"No.16/19,  Jayalakshmipuram 1st Street,  Nungambakkam,  Chennai 600034 Tamilnadu",charles@ekamoneness.org,https://www.giveindia.org/nonprofit/ekam-foundation
171,KHUSHII (Kinship for Humanitarian Social Holistic Intervention in India),education,New Delhi,"KHUSHII (Kinship for humanitarian social and holistic intervention in India) is an independent, non-governmental and non-profit organisation working for the up-liftment and holistic development of underprivileged children, women and vulnerable families. Founded in December of 2003 by Cricket legend Mr. Kapil Dev,KHUSHII is currently working in 6 states in India namely Delhi, Rajasthan, Haryana, Telangana, Maharashtra and Karnataka reaching out to approx. 28,000 children and impacting lives of more than 5 lakh in the communities in their fight against poverty, abandonment, social neglect.Through its flagship programme 'Shikshaantra Plus', KHUSHII addresses the challenges of poor infrastructure, low Pupil-Teacher Ratio, low learning levels and drop-out in government schools. Its 'Complete School Transformation' model in collaboration with State Education departments improves the school through remedial education, improving WASH, digital learning tools, STEM, sports and recreational facilities in school. KHUSHII in its endeavour to integrate communities with development of school initiated the programme 'Shiksha aur Vikas' in nearby communities. The programme works on the aspects of Adult Education and Life Skills, Health and Sanitation, Financial Inclusions and Economic empowerment through Skill Development and Livelihood. Our distinctive goal is to empower women and children from poor and marginalised communities leading to improved life of dignity through economic empowerment, better health and education.childrenNew DelhiSponsor remedial education of students in Delhi",+9818100959,"Building no. 2, Masoodpur Farms, Near JIMS, Vasant Kunj, New Delhi - 110070",harish.gosain@khushii.org,https://www.giveindia.org/nonprofit/khushii-kinship-for-humanitarian-social-holistic-intervention-in-india
172,Tarkeybein,education,Delhi,"Tarkeybein (tar-kee-bay) is an Urdu word which literally means “Ideas”- possibilities to us ! We, Tarkeybein Education Foundation (TEF), are a social impact organisation with a vision to bring systemic reforms in public education system through navigated learning approach which builds capabilities. We currently offer 3 programs — I Can Read, World of Possibilities and Quality Learning Initiative.Quality Learning Initiative: We are building cluster level academic platforms for primary & upper primary government schools with strong learning frameworks & principles institutionalised to maximise Learning Outcomes. Our ground operation is in Khekra Village, Baghpat District, Uttar Pradesh.We are registered as Not-for-Profit Section 8 Company with 12A & 80G certificates.",+9481841973,"Jaideep Rao, Tarkeybien Education Foundation, A 506 Gitanjali Apartments, Rishav Vihar Chowk Road, Shanti Vihar, Karkardooma, Anand Vihar, Delhi-110092",jaijrao@gmail.com,https://www.giveindia.org/nonprofit/tarkeybein
173,PRADAN,livelihoods,Delhi,"PRADAN was created in 1983 by two young professionals, Deep Joshi and Vijay Mahajan, who were convinced that even the stubborn, endemic poverty of rural India can be solved. They believed that well-educated professionals working within communities can bring both the empathy and knowledge needed to help poor people improve their lives.Deep and Vijay also believed that grassroots work in the spirit of pradan, or giving back to society, can be a fulfilling and viable vocation for educated men and women. They created Professional Assistance for Development Action (Pradan), to systematically groom and enable professionals with empathy towards the poor to work at the grassroots level.In 1987 PRADAN began working with the government and over the years they have played a major role in developing such programs as IRDP, SGSY, and the National Rural Livelihood Mission. They continue to work for change that is sustainable and self-perpetuating, bringing skills and systems that help women, families and communities gain confidence and take charge of their own lives.",+0120-4800828,"Professional Assistance for Development Action - PRADAN #3, Community Shopping Centre, Niti Bagh, New Delhi - 110049",contact@pradan.net,https://www.giveindia.org/nonprofit/pradan
174,Sshrishti India Trust,education,New Delhi,"Sshrishti made a humble beginning in 2003 at the residence of its founder Ms. Sanghamitra Bose, providing informal education to 50 - 60 children daily and functioned there for almost a year. Sshrishti, which means creation, was registered as a trust on 12th December 2003 and moved to its first rented premises in September 2004. Since then, Sshrishti has only grown from strength to strength in the number of beneficiaries it reaches and the number of centres it runs.Today, Sshrishti directly impact the lives of 1800 children daily through 7 Learning Centres in Delhi NCR and three in Uttarakhand for early years learning and remedial education, providing quality education and nutrition as well as supplementary educational facilities. Sshrishti provides skill training to the youth to enhance their employability for a better future and actively works towards improving the lives of marginalised women. In course of its journey Sshrishti has received considerable recognition awarded as the Best NGO in North India (small category) by the Rockefeller Foundation and the Resource Alliance in 2009 and featuring amongst the top four finalists at the India NGO Awards by Edelgive Foundation and Rockefeller Foundation in 2014. Sshrishti functions in a highly transparent and credible manner and has been accredited by Charities Aid Foundation, Credibility Alliance, Global Giving and Guidestar India. Education, Digital Literacy, Skill Development for employability and Women Empowerment have been our key focus areas for the last 15 years. Currently Sshrishti operates across several states including Delhi NCR, Haryana, UP, Uttarakhand and Punjab and has already touched the lives of more than 10 lakh target beneficiaries and we are eager to touch the lives of many more.",+91981801507,"Flat No. 203, 1st.floor, Kabir Apartments,76/9 Kishangarh, Vasant Kunj,New Delhi 110070",rjain@sshrishti.org,https://www.giveindia.org/nonprofit/sshrishti-india-trust
175,Guardians Of Dreams,children,Bangalore,"Guardians of Dreams is a registered non-profit organization working to establish universal access to quality child care across Child Care Institutions like orphanages/children's homes, open shelters etc. across the country. The NGO firmly believes that every child deserves a safe and happy childhood. By enabling Child Care Institutions, Guardians of Dreams increases their resources and improves the care quality to ensure children achieve positive life outcomes. The NGO currently operates across 3 districts - Bangalore, Chennai and Kochi.These are the Programs of the NGO :- - The Guardians Financial Aid Programme aims to build a safety net for children living in Children's Homes by enabling them to buy adequate food supplies for a nutritious diet, as well as cover the rent and maintenance cost to provide a safe space for the children to live in. The program aims to support 500 children living in Children's Homes in Bangalore and Cochin. This support will enable the caregivers to do what they do best - to focus on creating a safe and happy environment for children to grow up in.- Infrastructure Upgrade: Improves standards of safety, sanitation & space utilization by renovating existing children's homes to create a nurturing environment.- Guardians' Scholastic Awards: Empowers young achievers from 10th & 12th grades through a financial support program that enables smooth transition during their final years in the children's home.- After-School Education: Bridges foundational learning gaps by providing supplementary support and access to technology to ensure academic excellence.",+9744427900,"No. 8, New Friend's Colony,11th Main, 8th Cross, ST Bed Layout,Koramangala, Bangalore - 560047",contact@godreams.org,https://www.giveindia.org/nonprofit/guardians-of-dreams
176,Muktangan,education,Maharashtra,"Muktangan is an innovative model of education located within mainstream Government schools providing quality, child-centred, inclusive English-medium schooling to thousands of underprivileged children in Mumbai. Their learning environment nurtures sensitivity and free-thinking, developing the all-round personality of each and every child.  'Mukt' means freedom and 'Angan', the space in front of the home. They are actually the ""Education for the Community, by the Community"", developing teachers from the same neighborhoods as the students, who then become empowered change agents. They aspire to build and multiply a model of low-cost, high quality, youth education in the weaker section of the society and creating a program for empowering women in these communities by helping them to become teachers.  They have started a program called PCT as an educational programme to tender the education to orthodox people by providing high-quality English medium education for economically backward people in the society.They have built schools with 72 trained community teachers to teach around 3185 students.For their dedicated and hard work, they received the 'Most Committed NGO' of the Year by the Early Childhood Association India Working for young children and their education.Provide quality education to childrenI-11/12 Paragon Condominium  Pandurang Budkar Marg, Worli,  Mumbai 400013 Maharashtra",+91 8779275542,"I-11/12 Paragon Condominium  Pandurang Budkar Marg, Worli,  Mumbai 400013 Maharashtra",ketakighaisas@muktanganedu.org,https://www.giveindia.org/nonprofit/muktangan
177,Maitri India,women,Delhi,"Maitri is a New Delhi-based developmental humanitarian NGO that is committed to facilitating every individual's Human Rights, especially the Rights to Identity, Dignity and Respect. Since 2005, Maitri has worked with over 45,000 individuals on the issues of social and health inequities and public health concerns through education, community outreach, networking, and legal advocacy. Maitri work is organized under two main pillars: Violence Against Women and Migrant Workers. The organization has been addressing the issue of violence against women (especially in the uniformed forces), running a victim support and victim to survivor program, and promoting dignity and support for abandoned elderly widows in Vrindavan (Mathura, India). Their initiatives with Migrant Workers include facilitating access to Citizenship Rights to ensure access to basic rights including healthcare to vulnerable migrant populations like rickshaw pullers and the homeless, and providing educational and skill-enhancement opportunities for underserved children and women respectively. They also run an Integrated Counseling and Testing Center (ICTC) for HIV/AIDS.In 2005, Lt. General Bhopinder Singh (Retd) and Winnie Singh founded Maitri upon identifying the need for support for members of the Uniformed Services affected by HIV/AIDS. Since 2007, Maitri has expanded its areas of reach through a variety of projects. A world in which each individual lives with identity, dignity, and respect.Maitri's mission is to act as a catalyst to enable access to basic rights to some of the most Marginalized and Vulnerable Populations in India including:1) Women who are at the risk of facing Gender-Based Violence2) Destitute and Elderly Women/Widows3) Migrant Workers and their families in urban environmentsSponsor the cost of basic clothing for an elderly abandoned widow",+91 9667558900,"R.K. Puram Sector 13,New Delhi 110064 Delhi",maitri.india@maitri.org.in,https://www.giveindia.org/nonprofit/maitri-india
178,Udhavum Ullangal Public Charitable Trust,health,Tamil Nadu,"Udhavum Ullangal (Helping Hearts) is an NGO and a registered public charitable trust. It attempts to bring in a change to the lives of the less privileged in the area of health, skill, and education. The journey started with a core team of professionals in the year 2000. Their vision is to create awareness and build a socially conscious selfless society helping people in distress, poverty and during the crisis.Mr. Sankar Mahadevan, Founder Trustee is a former bank employee - His inner drive to support the people in distress and poverty made him to leave his bank job to devote full-time to the organization. He started Udhavum Ullangal as a result of this drive for 'creating a selfless society'. Udhavum Ullangal is also served by four other trustees.",+91442434474,"No.77, 1st Main Road, CIT Nagar, Nandanam,Opp FIAT Car Showroom, Chennai - 600 035, Tamil Nadu, India",info@udhavumullangal.org.in,https://www.giveindia.org/nonprofit/udhavum-ullangal-public-charitable-trust
