,Names,Cause,State,Description,Phone,Address,Email,URL
63,Ashray Akruti,differently abled,Telangana,"Ashray Akruti is a registered non-profit, non-religious organization and also is member of the World Hearing Forum which is recognized by World Health Organization (WHO); working since 1996, to improve the lives of children with disabilities from marginalized sections of society. The organization strongly believes in the potential of persons with disabilities and envisions a society where people with disabilities lead a life of dignity as equal citizens with equitable access to opportunities and services. Ashray Akruti offers quality education, health care, and sustainable livelihoods to people with disabilities and underprivileged. We also equip special education and rehabilitation services for children with disabilities and provide ear and hearing screening, diagnosis, and management through outreach programs for children and adults. Residential facility is also provided to children who come from other states and outside Hyderabad. Ashray Akruti is reaching out to the vulnerable section of the society by providing groceries and other consumable goods and commodities. Akruti is an accredited organization certified by “Credibility Alliance”, following norms of accountability, transparency, and good governance. It is empanelled with the National CSR hub of the Tata Institute of Social Sciences. Ashray Akruti was awarded as the Best NGO in Hyderabad by Government of Telangana on 1st June 2016. Ashray Akruti received ""The Best Institution"" State Award for its services in the disability sector in the year 2017. Ashray Akruti received Transparency award from GuideStar India. We render quality services and protect the rights and dignity of the hearing-impaired.Gift a hearing aid to a hearing impaired childEducate a poor hearing impaired childSponsor the stay of a hearing impaired child",+91 040 40042250,"8-3-1027;A2, Lane Opp.Indian Bank,  Hyderabad 500073 Telangana",anuda@ashrayakruti.in,https://www.giveindia.org/nonprofit/ashray-akruti
64,Sai Kripa,children,Uttar Pradesh,"The mission of the organisation is to provide homeless, abandoned children with the basics of life - a home, education, love and affection, and above all, an existence with dignity.Saikripa is essentially the brainchild of Anjina Rajagopal. She had always nurtured the desire to work with poor children. Anjina Rajagopal was touched during her younger days by the plight of the orphans soliciting alms on the streets. This pushed her to come into the social work space, full-time, leaving behind a lucrative livelihood. In 1989, Sai Kripa was registered. In 2017, Ms. Anjina Rajagopal was awarded the Laasya Awards by the SUBH Power Collage Consultants Award for Women of Exceptional Background.In 1988, Saikripa was like a baby lost in the woods - because nobody took Anjina and her brainchild Saikripa seriously. But slowly people started joining hands with Saikripa and a strong bond was formed. On 27th February 1990 BAL KUTIR formally opened its doors to children at F-44, Sector-20. It started with one child but now it has grown into a large family of children who are as happy and intelligent as any child who has his own family. Apart from this, 11 children have taken up jobs and are living independently,3 three girls have been married off and more than 75 children have been restored to their families with the cooperation of the police and the public. BAL KUTIR was set up not only to provide shelter and the basic needs of children, but also Home to provide them with love and affection. On 8th April 1991 Sai Shiksha Sansthan an English medium school was started in village with classes up to 2nd Std. Today the school has come up to the 10th std. Children given nutritious food - 60Children provided education up to Grade 10 - 69Children educated at Sai Bal Sansar - 180Sponsor the English medium education for a poor studentSponsor meals for orphaned or abandoned children",+91 120 2531521,"Z-133-134, Sector-12, Noida 201301 Uttar Pradesh",agaur15aug@gmail.com,https://www.giveindia.org/nonprofit/sai-kripa
65,Child Nurture and Relief Kashmir (CHINAR Kashmir),education,Jammu and Kashmir,"The Kashmir conflict had created a large number of orphans in addition to causing major social change, CHINAR Kashmir was formed to address the psychosocial needs of these orphans. The organization focuses on improving the lives of marginalized children, women and families. CHINAR Kashmir runs several innovative programs geared towards the social and economic empowerment of women and youth and providing material assistance to impoverished families whose homes have been damaged due to natural disasters or other reasons. Remote Child Sponsorship Program, CHINAR Home Program, Disaster Relief and Rehabilitation, Skills Enhancement and Entrepreneurship Development, Giving House Assistance and Relief are the programmes presently run by CHINAR.  The children residing in the CHINAR homes are provided with quality education in good private schools and in-house tuition. A myriad set of extra-curricular activities are also organized to ensure a well-rounded education. CHINAR Kashmir is relentlessly providing these children with a stable support system so that they can lift themselves out of the cycle of violence & become productive members of society.Educate an underprivileged child in Kashmir Opposite Ply Emporium, Barzulla Srinagar 190005 Jammu & Kashmir",+91 97070 48654,"Guru Lane,  Opposite Ply Emporium, Barzulla Srinagar 190005 Jammu & Kashmir",khansumiya2001@gmail.com,https://www.giveindia.org/nonprofit/child-nurture-and-relief-kashmir-chinar-kashmir
66,Foundation for Excellence India Trust (FFE India Trust),education,Karnataka,"The Foundation for Excellence (FFE) is a registered non-profit, based in the USA and was founded by the serial entrepreneur, Dr. Prabhu Goel. The Foundation for Excellence India Trust (FFEIT) was registered in 2003 as a public Charitable Trust in India to expand the scope of FFE’s  support and works in association with FFE. It has the same objectives as FFE,  but raises resources from donors worldwide. Foundation for Excellence was formed with the mission to help economically underprivileged and academically bright students complete their higher education through a Scholarship Program. The objective of the program is to help these students and their families transition from a low to middle income group in a single generation. The scholarship program also envisions a multiplier effect as each scholar will then go on to support at least 2 other scholars in his/her lifetime.In twenty five years since its inception in 1994, FFE has already helped over 22,400 scholars across India, changing their lives for posterity; over 63,800 scholarships in excess of USD 27 million (~Rs. 189 Crores) have been awarded to students in 27 states in India. FFE has a network of over 500 volunteer “facilitators” distributed throughout India who identify potential awardees, verify the genuineness of their need, and act as mentors once the scholarship is awarded. This ensures that only genuinely deserving students are awarded scholarships.2019-20 has been a record-breaking year on multiple fronts. FFE awarded a total of 6383 scholarships amounting to Rs. 27.27 Crores during FY 2019-20. Of these, 4756 scholarships were awarded to Engineering students and 1565 to Medical students. FFE also launched scholarships supporting 2 new disciplines in FY 2019-20, awarding 17 LLB scholarships to students pursuing law, and 45 scholarships to students pursuing BPharm degrees in India. FY 2019-20 saw the largest and most involved alumni participation in the ""Circle of Giving"", with more than 1500 alumni contributing in excess of Rs. 1 Crore to FFE, another milestone that was achieved in close collaboration with FFE’s alumni.educationEducate an underprivileged engineering student",+91 89792 82552," 5th Main, Indiranagar 1st Stage, Bangalore 560038 Karnataka",donorsupportindia@ffe.org,https://www.giveindia.org/nonprofit/foundation-for-excellence-india-trust-ffe-india-trust
67,Make A Difference,education,Karnataka,"Make A Difference (MAD) is a youth driven, non-profit organisation working to ensure equitable outcomes for children in orphanages and street shelters. Registered as a non-profit in 2006, Make A Difference reaches out to over 3,460 children in 67 shelters across 23 cities in India, through a highly efficient 3,822 strong volunteer network. Volunteers commit a year and spend between 2 and 10 hours every week mentoring, teaching and interacting with children in order to ensure that they get the support and care they need during childhood.Their aim is to ensure that even the most vulnerable children in shelters are able to realize equitable outcomes and that they are able to live a life free from exploitation, with a capability of managing emotional and financial life crises.Support education of children in a shelter homeSupport living expenses of children in a shelter home",+91 99003 99313,"16 C, 1st Main Road 14th Cross Bangalore 560102 Karnataka",mannat@makeadiff.in,https://www.giveindia.org/nonprofit/make-a-difference
68,Amar Seva Sangam,education,Tamil Nadu,"Amar Seva Sangram was established to help differently-abled and underprivileged children. Their mission is to empower disabled citizens by rehabilitating them and integrating them into mainstream society. They have a home for rehabilitated physically challenged people that provides free shelter, food, clothing, medical aid, and appliances. Around 50 children with loco-motor disability and associated problems are attended to and provided with special medical care. The school for specially-abled children, Sangamam, provides free education. In Village-based rehabilitation, differently abled people, as well as communities, are involved in the rehabilitation process. They are organized into Self Help Groups for their development and get access to different government schemes. Early Intervention Center aims to intervene as early as possible and minimize disability so that the child can reach the highest potential. They cater to the needs of the children under 5 years. 30 Special children have been served so far, out of which 8 have been mainstreamed. Amar Foundation is a trust, with a mission to generate employment for the rural poor and handicapped. They have 65 employees of which around 25 are specially-abled. Sri S. Ramakrishnan, the founder was awarded the Amazing Indians Award for his extraordinary work and selfless devotion.Help rural children get access to nursery educationEducate poor children in an integrated schoolHelp a differently abled person walk independentlySulochana Gardens, ",+91 4633 249170,"7-4-104B,  Tenkasi Road, Post Box No. 001,  Tirunelveli District,  Ayikudy 627852 Tamilnadu",secretary.amar@amarseva.org,https://www.giveindia.org/nonprofit/amar-seva-sangam
69,Towards Future,education,West Bengal,"A few like minded people willing to contribute their time, resources and emotion to the weaker section of the society, have managed to form an organization named Towards Future.Supriya Roy Chowdhury, the Founder and current head of the organisation, with some like minded friends decided to do something good for the society and formed Towards Future in 2008. Before Towards Future's registration Supriya worked in different NGOs for 13 years and has noticed that poor children are not receiving quality education. So the team of Towards Future decided to begin with child education which started with eight children at Kalyani center. Later on corporate houses like Wipro Cares, Acclaris Business Solutions Pvt Ltd and some generous donors came forward to assist Towards Future which makes the job of the team smooth and easy. During her working period with other organizations, Supriya gathered experience in the field of child education, so she felt like contributing to this sector. Supriya also worked in the field of women rights issues, so later on Supriya introduced a project on women rights in Towards Future.The aims of Towards Future are:- Offering opportunities for basic education- Access to primary and vocational education- Reduce infant mortality- Improve health & Hygiene- Promote sustainable economic development- Promoting women empowerment- Conserve and protect ecology and environmentNumber of children enrolled in remedial class program and continued till end of academic year - 34Number of children enrolled in primary school program and continued till end of academic year - 140Number of children receive support throughout the year - 5Number of children enrolled in preschool program and continued till end of academic year - 98Number of beneficiaries participate in our different women empowerment activities throughout the year - 200Number of children enrolled in non-formal learning program and continued till end of academic year - 251Sponsor nutrition and pre school expenses of a poor child",+91 98316 30412,Kolkata 700055 West Bengal,supriya_royc@yahoo.com,https://www.giveindia.org/nonprofit/towards-future
70,Adarsh Charitable Trust,differently abled,Kerala,"With a mission to provide rehabilitation measures, Adarsh Foundation was started in the year 1998 in Kerala and is currently under the chairmanship of Shri. K P Padmakumar. Its dedication to its mission helped identify hundreds of children with disabilities from their birth.  The foundation has 3 centers with 15 physiotherapists and 18 special educators. Apart from that, it caters to about 55% children who are below 3 years and fall below the poverty line. Adarsh foundation has a full-time staff, special educators, and physiotherapists who work with equal dedication in taking the foundation closer to its mission day by day.  It has gone beyond in reaching out to those who need their support and help. Till date, with the support from the foundation, more than 200 children have been able to sculpt their way into the mainstream. Adarsh foundation has a staunch belief that rehabilitation is possible and disability can be specifically identified and treated with appropriate therapy and training. This makes it an institute of excellence in the rehabilitation of children with challenges.Help a differently abled child get independent with therapyHelp a differently abled child go to schoolX:",+91 48427 94099,"584-B, Puthiya Road,  Kureekkad, Ernakulam 682305 ",guruaswin@yahoo.co.in,https://www.giveindia.org/nonprofit/adarsh-charitable-trust
71,Vathsalya Charitable Trust,education,Karnataka,"Vathsalya Charitable Trust was started in 1988 in Bangalore, Karnataka to offer shelter and security to homeless women and children. Vathsalya was started to supplement the services for child care and adoption of destitute children. Their mission is to facilitate the creation of an ecosystem for children to flourish within their adoptive and birth families, by leveraging our experience in the area of family preservation and strengthening. Vathsalya Charitable Trust was started with the goal of providing a family and a home for orphaned and abandoned children. The organization's mission is to preserve and provide a sustainable environment for a healthy mother, children, and families by providing nutrition, education, and counseling.Jessy Job, Executive Director of Vathsalya Charitable Trust is an experienced Social worker who has done her Master's in Social Science. She is specialized in Community Development programme and had been involved in various community programmes for the past 15 years. She also has a Counselling Diploma from TRADA as well as Gender Trainer Training course certificate from Lal Bahadur Shastri National Academy at Mussouri. Close to a 1000 children have received an educational scholarship though VathsalyaSponsor the school fees of a girl childNo. 717, 5th Cross, 1st Block,  HRBR Layout, Kalyan Nagar Bangalore 560043 Karnataka",+91 80 41480194,"No. 717, 5th Cross, 1st Block,  HRBR Layout, Kalyan Nagar Bangalore 560043 Karnataka",vathsalya1988@gmail.com,https://www.giveindia.org/nonprofit/vathsalya-charitable-trust
72,NIIT Foundation,education,Delhi,Missing, +11-41675000,"8, Balaji Estate, Kalkaji, New Delhi - 110019",contact@niitfoundation.org,https://www.giveindia.org/nonprofit/niit-foundation
73,Dr Shroff s Charity Eye Hospital,health,Delhi,"With 20,000 surgeries; around 30,000 eye screenings and more than 1500 eye surgeries to the children- this humongous work without a second thought are being done by Dr. Shroff's Charity eye hospital (SCEH). SCEH was founded in the year 1914 to facilitate eye care to the underprivileged. With a mission to be the best Tertiary Eye and ENT Care Institution in Northern India, the clinic stands out when it comes to quality eye care. Graduating from Royal college of Surgeries, London, Mr. Shroff established the eye care center in the year 1926 with the best equipment from those times. Right from Retinal to Cornea, eye cancers to surgeries, cataract to the general care; SCEH has 125 full-time staff with over 35 doctors attending constantly to those in need. SCEH is synonymous with a vision for its excellent and committed service.Restore eye sight to a patient with cataract surgerySponsor a phaco eye surgery for a poor patient",+91 11 43528828,"5027, Kedarnath Road,  Daryaganj, New Delhi 110002",kiranmehta@sceh.net,https://www.giveindia.org/nonprofit/dr-shroff-s-charity-eye-hospital
74,Gramin Vikas Vigyan Samiti,environment,Rajasthan,"GRAVIS works in the States of Rajasthan, Uttarakhand, and the Bundelkhand region of Uttar Pradesh. Currently, GRAVIS' interventions support about 1.3 million people living in over 1,500 remote villages. The organisation believes in participatory community development that blends traditional knowledge and modern sciences and that promotes equality. education is one of the main pillars of sustainable development as it allows future generations' access to new ideas and resources. GRAVIS has been a strong proponent of education for the poor of the Thar Desert and has hopes of giving children a brighter and financially secure future. Till date, 98 schools with more than 7,000 students have been set up by GRAVIS and many of them are now run by village communities independently. These schools are often located in the areas of villages where no government school existed, and some provide midday meals for students. Once these schools are well established, GRAVIS hands over the administration to the local Village Development Committee or the state school system. GRAVIS donates bicycles to students who wish to attend secondary schools. This support focuses on female students who have to date been given 230 bicycles.GRAVIS has recently constructed a new girls hostel building in one of its centers where the girls will stay to receive middle and high school education. The center can accommodate up to 16 girls, who live there and participate in many activities.Educate a poor girl child from a remote village for a year3:",+91 291 2785116,"458, Milk Men Colony, Pal Road, Jodhpur 342008",rahul@gravis.org.in,https://www.giveindia.org/nonprofit/gramin-vikas-vigyan-samiti
75,Apnalaya,women,Maharashtra,"Apnalaya is a secular voluntary organization, that has been building self-sustaining communities since 1973. It aims to empower the disadvantaged to overcome the social, political and economic barriers and help them lead a better quality of life. They work with the most marginalized people dwelling in the slums of Mumbai. There are 4,200 children under 6 years of age at the center of Apnalaya’s Health Program.The Health and Disability related interventions emphasize on empowering community members to improve health seeking behavior and access healthcare instituted by government agencies. The Livelihood program equips young boys and girls, men and women to identify the potential of opportunities and turn them into economic productivity. They provide sewing classes, enroll and train women who otherwise have been under cultural restraints to stay away from income-generating activities.209 women have economically benefited from Self Help groups organized by Apnalaya. The Education and citizenship program aims to bring together the volunteers from the community so that they have a better understanding of the challenges faced by their community and identify their responsibilities towards it. In 2017, Apnalaya was awarded the Champion Level- GuideStar India Platinum for highest levels of transparency and public accountability.Help poor women get access to gynecology servicesEnable counselling help for domestic violence victimsSupport the education of poor adolescent children",+91 22 23539752,"B/9-103, New Jaiphalwadi  SRA Co-op Housing Society  Behind Police Quarters,  Tardeo, Mumbai 400036 ",ninad@apnalaya.org,https://www.giveindia.org/nonprofit/apnalaya
76,Haritika,livelihoods,Madhya Pradesh,"Haritika, as the name suggests, is a Trust that was formed for bringing about a green revolution in the water-scarce regions of Bundelkhand. By tapping into various water sources, they have proactively worked on sustainable projects relating to water harvesting and management, crop optimization, soil conservation and afforestation.  This initiative has complemented their focus on child education, women empowerment, health, environment and the socio-economic upliftment of the poor, in the communities, they work in. Their diligent efforts on more than 20 projects with support from national and international partners have resulted in the assured water supply to 42,000 people for domestic requirements and irrigation to a land of 13,000 hectares. These accomplishments resulted in an increase in the number of girl students attending schools and a considerable decrease in the number of cases of genito-urinary infections among other ailments.  With other projects on natural resources' management; water and sanitation; health and livelihood opportunities - members of Haritika aim at a just, enlightened, healthy and democratic Bundelkhand, free of hunger, poverty, environmental degradation and all forms of exploitation irrespective of age, sex, religion, and ethnicity.Support poor farmers with free saplings",+91 90652 20319,"M6, Mahendra Puri Colony,  Behind Govt. Girls Polytechnic,  Gwalior Road,  Jhansi 284003 Uttar Pradesh",angrag@rediffmail.com,https://www.giveindia.org/nonprofit/haritika
77,Chintan,environment,Karnataka,Missing, +11 29842809,"238, Sidhartha Enclave, New Delhi, India - 110014",info@chintan-india.org,https://www.giveindia.org/nonprofit/chintan
78,Community Aid & Sponsorship Programme (CASP),education,Maharashtra,"The biggest disease is not leprosy, but rather the feeling of being unwanted. Especially, when children are the victims of something that is not their fault. Maharashtra in the late 1970s was affected with Leprosy. The kids of these affected were shunned. A couple approached Social Scientist, Dr. Gokhale expressing their distress about the discrimination of their kids. Being a social scientist, Dr. Gokhale understood the importance of family. He considered their request and began to identify donors who are ready to sponsor the education of these children. This led to the establishment of Community Aid and Sponsorship Program (CASP) in 1976. CASP slowly shaped into a national voluntary organization by supporting underprivileged children and communities. It provides sponsorship & aid for education, health, and nutrition. Mr. Pramod Kale the president of CASP has been working in the field of Community Education and Development for a very long time. His work has been recognized with Padmashree in 1984 and Aryabhatta Award in 2006 of the Astronautical Society of India. With a mission to diversify and strengthen its organizational competency, CASP leads in developing and implementing strategies and programs. These programs enhance the capacities of children, families, and communities through empowerment, participation, and advocacy.Secure the future of a poor studentCASP Bhavan, S.No. 132/2,  Plot No.3, Pashan Baner Link Road,  Pashan, Pune 411021 Maharashtra",+91 20 25862843,"CASP Bhavan, S.No. 132/2,  Plot No.3, Pashan Baner Link Road,  Pashan, Pune 411021 Maharashtra",caspheadoffice@gmail.com,https://www.giveindia.org/nonprofit/community-aid-sponsorship-programme-casp
