,Names,Cause,State,Description,Phone,Address,Email,URL
123,Rural Health Care Foundation,health,West Bengal,"Rural Health Care Foundation (RHCF) is a non profit organisation based out of Kolkata. It offers primary healthcare to the underprivileged community through a chain of 15 primary health centres located in remote rural regions of West Bengal and the urban slums of Kolkata. Against a nominal amount of Rs. 60 ($0.89) a patient receives consultation, treatment and free medicines for a week. A project started by two brothers, has now transformed to an initiative serving millions of patients per year and generating employment for many. The organization was set up following the prolonged suffering of one of its founders with cancer, since an early age. This exposed to him and his brother, the lack of quality health care facilities in India, particularly so for the rural poor. The brothers got together with like-minded people and established RHCF which provides low cost, quality health care in rural areas based on a model that is scalable, sustainable and replicable. Anant and Arun Nevatia wound up their booming construction business and started this initiative for the poor. He realised there is no end to money making and he decided to give back to society. Taking this vision forward the brothers started this initiative to provide health care to the poor. RHCF centres run six days a week throughout the year. They have treated over 15 lakh patients in their 15 primary health care centres.Help villages and underserved areas get access to health careSponsor the cost of spectacles for the underprivileged",+91 03340082981,"Foundation33,AlexandraCourt, Old No 60/1 (New No 63), Chowringhee Road,Kolkata - 700020",shreyasnevatia@gmail.com,https://www.giveindia.org/nonprofit/rural-health-care-foundation
124,Salaam Baalak Trust- Mumbai,children,Maharashtra,"In the last twenty seven years Salaam Baalak Trust, Mumbai has helped thousands of children come off the streets and into a safe and nurturing environment. Today they provide an integrated safety net of services catering to the individual needs of street children in Mumbai, covering the entire realm of child development from physical and medical needs to encompassing the educational, creative, cognitive, social and vocational needs of the children.  The objective is to provide them every opportunity for holistic development so that they become responsible, contributing members of society. SBTM has three Day Care Centres located at Chowpatty, Andheri and Kalyan. Two of these Centres also provide Night Shelter and there is a Balwadi at the Chowpaty centre.  The Solapur Project for rehabilitation of Pardhi street children has been expanded to include a Day Care as well as a Night Shelter. There is also a Careers Project that gives direct training and subsequent employment opportunities to street children in partnership with the Business Community and other NGOs. Salaam Baalak Trust, Mumbai are also the collaborative organization with ChildLine for Thane city.Salaam Baalak Trust was born in 1989 with a portion of the proceeds from the film Salaam Bombay! by Mira Nair. The Trust began its work with an aim to give street children choices and a chance to experience the joys of childhood.Agnes Fernandes began as a Project Co-ordinator at Salaam Baalak Trust Mumbai after having spent almost 2 decades in the Corporate Sector with Proctor and Gamble. She moved to the position of educational Consultant so that she could work with all the projects at SBTM. She was Chowpatty Coordinator and that and other experience has put her in the perfect position to be the Programme Director.education of street children in Mumbai and Thane district - 620Small children (pre-schoolers) attending Balwadis in Chowpatty and our Contact Points in Sathe Nagar, Saibaba Nagar, Shanti Nagar and Kranti Nagar - 49Children getting shelter in night shelters in Andheri, Borivali, Kalyan and Solapur - 229Youth from Grades 8, 9, 10 & College taken for exposure visits to various organisations - 94Rehabilitation of street children including drop outs from Solapur, through referrals to other institutions and/ or CWC or rehabilitation with their families - 6Pardhi community children educated in schools in Solapur - 106Youth helped for Vocational training, Job placements - 3Help in providing a safe night shelter for street children",+91 22 66575439,"Netaji Subhash Marg, Charni Road (W) Mumbai 400004",kashmarfatia@gmail.com,https://www.giveindia.org/nonprofit/salaam-baalak-trust-mumbai
125,SAMUHA,differently abled,Karnataka,"SAMUHA' derives its name from a Sanskrit word, which means an organized group or society. This reflects their ideology that ""development is best sustained when undertaken through group processes "".They work with vulnerable people to improve their quality of life within defined periods of time. Their mission is ""To Improve the Quality of Vulnerable People within Defined Period of Time"". Based out of Koppal, the Samarthya wing of Samuha works specifically with the differently-abled in Karnataka and was awarded the State Award for Organisations by the Directorate of Disabled and Senior Citizens Empowerment. They are supported with 150 Full-time staff, 5 Volunteers and 46 Consultants, who work on implementing a plethora of projects ranging from the Early Intervention Centre and Mobility Aids workshop to their screening camps and Spinal Cord Rehabilitation Centre. Samarthya works across 352 villages in the Koppal and Raichur districts of Karnataka, impacting the lives of over 3700 differently-abled people every year.Help spinal cord injury patients get access to physiotherapy Kanakagiri, Gangavati Taluk,  Koppal District 584119 ",+91 85302 34449,"Vithalapur Road,  Kanakagiri, Gangavati Taluk,  Koppal District 584119  Karnataka",hampanna@samarthya.org,https://www.giveindia.org/nonprofit/samuha
126,Salaam Baalak Trust - Delhi,children,Delhi,"SBT aims to provide a sensitive and caring environment to the street and working children and other children on the margins of society. It seeks to dissolve the barriers that rob these children of the opportunity to realize their rights.In the 1980s, the making of Mira Nair’s ‘Salaam Bombay’ (award winning film) revealed the dark underbelly of Mumbai’s streets, where several childhoods were at stake. A combination of socio-economic exigencies, political circumstances and parents’ struggle for survival created a large population of children, living and working on the streets of India. All across the country, the street children, an invisible section of the society, continued an invisible struggle on the streets of Delhi too.In the day time, children grapple with the challenges of street life. When night falls, they curl up in crevices - at the end of the platform, under a staircase, in the subway - where the possibility of security exists. Ms Praveen Nair, Chairperson and Trustee at Salaam Baalak Trust testifies: “It took us quite a while to break the ice with the boys. Sanjoy (Roy) and myself would scout the railway platforms every day, chat with the boys, however they had been cheated time and again, and we weren’t the first to propose help. So, they would laugh off our intentions but we never gave up. Finally, when we answered their urgent call for help to care for a terribly sick boy, a friend of theirs, began the never-ending bond.”Having spent quality time with these children, the founding members of the Trust realised that while most of these children were forced into these circumstances, many of them had chosen this life. What set them apart, was their chutzpah, their spirit. Ms Nair adds: “We started with the idea of donating blankets to the children in the bitter winter cold. We started at the very place where GRP centre now stands. However, we were naive about their actual needs. The children told us that sleeping under a blanket invited sexual attentions from older children. They stuffed newspapers and wore layers of clothing (all the clothes they possessed, actually) which not only kept them warm but also kept the clothes from being stolen! That’s when we realised that these children needed a roof over their heads and safe spaces.”From three staff and 25 children on a balcony of the Ground Reserve Police at the New Delhi Railway station more than 32 years ago, we have now grown to over 250 staff, providing support services for approximately 10000 children a year in Delhi and the NCR region through our 7 shelter homes and 10 contact points.Over the years, Salaam Baalak Trust has successfully worked with over 1 lakh children; out of which significant numbers have been restored to their families. Every year almost 10-11 children across SBT pursue higher education. We have children who grew up to become lawyers, fashion designers, photographers, puppeteers and engineers. This year, three of our children have got more than 80 percent in their 12th board exams.Sponsor runaway children to reunite with their families2nd Floor, DDA Community Centre, Paharganj New Delhi 110055",+91 11 23586416," 2nd Floor, DDA Community Centre, Chandiwali Gali, Paharganj New Delhi 110055",contact@salaambaalaktrust.org,https://www.giveindia.org/nonprofit/salaam-baalak-trust-delhi
127,Swades Foundation,education,Raigad,"Swades Foundation was founded by Ronnie and Zarina Screwvala. Swades Foundation operates with the aim of empowering rural India. Our vision is rural empowerment through incorporating better innovative practices, modern technology and values. Our Mission is to empower 1 million rural Indians every 5-6 years, and to catalyse a lasting, irreversible change for the good. We have been on a philanthropic journey spanning 35+ years, operating at scale since 2013 as a grassroots implementation organization – with 280+ full-time staff and approximately 1000 volunteers impacting over 5.5 lakh lives across ~2500 villages in Raigad district, Maharashtra. We are now entering Nashik district beginning work with Igatpuri.Our focal point is rural empowerment through holistic, 360 degree development across 4 core themes:- Education, Health, Water and Sanitation, and Livelihoods. Our strategy is to Engage, Empower, Execute and Exit: To engage rural communities with corporates, young urban India, not-for-profit organizations and governments and empower our communities to execute programs that transform their own lives, enabling us to exit and allowing them to serve as role models and change agents for the rest of the country.educationRaigadPrevent dropouts by helping rural children complete schooling",+91 22 6109 3711,"75, Dr Annie Besant Road, Worli, Mumbai - 400018, Maharashtra",fr@swadesfoundation.org,https://www.giveindia.org/nonprofit/swades-foundation
128,Seva Sahayog Foundation,health,Pune,"Seva Sahayog Foundation is a volunteer-driven organization working in various social development areas. Our registered volunteer base is 20,000+ and  with the support of 150+ full time volunteers, 200+ corporate partners, we run various projects, which are focused towards fulfillment of deprived needs of socio-economically challenged strata of the urban slum communities. To achieve our objectives, SSF engages socially conscious corporates, groups, individuals and other NGOs with various of our programs in Maharashtra. Since 13 years Seva Sahayog Foundation is working on connecting various companies, organizations and people with needy sections of our society, mainly from areas in and around Pune and Mumbai. Our core activities are education, woman empowerment, health and environment. These include providing conducive environment at CLCs to children, education of adolescent girl children, skill-development for youths and self-sustainable empowerment of women from seva wastis/communities. Therefore, our projects are exclusively linked with seva wastis.",+9922157422,"18 - Pathik,Vrundavan Society,Near Mhatre Bridge,Navi Peth, Pune",nitin.pataskar@sevasahayog.org,https://www.giveindia.org/nonprofit/seva-sahayog-foundation
129,Society of Community Health Oriented Operational Links (SCHOOL),elderly,Maharashtra,"SCHOOL (Society of Community Health Oriented Operational Links), a not-for-profit organization implements its flagship initiative 'Healthy Ageing' which focuses on building an age-friendly eco-system for the elderly population in India. We aim to provide comprehensive support for the elderly people (aged 60 years and above) We are working with the families of the elderly, working with the government system for schemes and programs for the elderly.",+9958823373,"Pune Office: Opp to Dabhade Ration Shop, Kasturba Vasahat, Pune 411007Delhi Office: A-16, Sukhdev Vihar, New Delhi 110025",bpatil@school4dev.org,https://www.giveindia.org/nonprofit/society-of-community-health-oriented-operational-links-school
130,Samerth Charitable Trust,education,Gujarat,"The vision of the organisation is to build a world on the pillars of equal opportunities, access to resources, gender equality, democratic governance, participatory learning and respect of diverse cultures.With a presence in both rural as well as urban areas, Samerth primarily works with women and children. Apart from catering to the educational needs of children between the ages of 3 and 6, they also run centres that double up both as counseling centres for women suffering from domestic violence as well as informational hubs where men and women can access information regarding various government schemes. They also work on providing water security and irrigation in the arid region of Kutch and on capacity building of underprivileged women in the rural areas they operate in.SAMERTH was started to create a humane, sustainable and equitable society through strengthening peoples' capacities and equipping community institutions so that they are informed and are able to access their rights to have a human existence. The programme is developed as per the requirement of the community. In Kutch, they focus on water availability and leveraging resources around it. In the city of Ahmedabad, the organisation has working with urban poor and giving them access to education and developing leadership amongst women and adolescent girls and boys. In Chattisgarh, the focus is to work with tribal communities and create and facilitate the process of accessing entitlements and education.No. of children impacted - 55No. of people impacted - 236No. of children receiving nutrition - 704No. of families impacted - 30No. of children availing the facility - 22Gazala Paul has a Masters in Social Work (MSW) from Indore School of Social Work, (Devi Ahilya University), Indore, India in 1987 and a Masters in ""Coexistence and Conflict Management"" from Brandeis University,Massachusetts, USA in February 2006. Since May 1999, she has been the CEO of Samerth. Since April 2006 she has been a consultant to Paul Hamlyn Foundation, UK as Advisor for developing programme on accessing quality education for the tribals and urban poor, disability rights, forest rights, enabling women's role in local governance and addressing issue of violence against women for the west India programme. She has also worked with with Oxfam-Great Britain as Project Officer from 1992 to 1999 for the Gujarat and Rajasthan States of India developing programme on rights based issues for the vulnerable communities and mitigation strategy for disaster management.",+91 07926829004,"Q-402, Shrinandnagar, Part 2, Vejalpur Ahmedabad 380051 Gujarat",iqbalsamerth@gmail.com,https://www.giveindia.org/nonprofit/samerth-charitable-trust
131,Sapna,children,Rajasthan,"Sapna was created by a group of professionals who shared a dream to work on a people-centric model of development in areas of public health, education, women empowerment, community development and social welfare.  Inspired by Gandhian ideals of social change, their primary objective is to: Empower the poor and marginalized; Provide shelter to the sick and destitute; Promote community health programmes and services; Support literacy centers and e-learning; Facilitate livelihood programmes; Help the poor access information and resources; Work for environment protection and conservation. Their basic focus is to help those who are the most vulnerable and are in dire need of help.They believe that development has to be holistic to break the vicious cycle of poverty and wish to bring about visible change. They work by focusing energies in these sectors as well as building their understanding of the related issues. They believe that any organization, or for that matter, any individual, whose fundamentals are based on the virtues of honesty, ownership towards our society and regard to human dignity, are bound to grow in the right direction and the last 10 years have been a testimony to this philosophy.Support the nutrition of poor girls to aid educationHelp sick and destitute adults live with dignityEducate an underprivileged girl childHelp provide cataract surgery to people in RajasthanHelp provide counseling to women",+91 144 2767169,"Flat No. 8086, Pocket D8, Vasant Kunj, Delhi - 110070",ngo.sapna@gmail.com,https://www.giveindia.org/nonprofit/sapna
132,Sarada Ramkrishna (Sishu O Mahila) Sevashram,women,West Bengal,"Sevashram initiated destitute/orphan residential girls' home with 25 rural poor girls. It was then sanctioned by the Social Welfare Department of both Central & State Government. At present, more than 150 children are being nurtured and cared with the facilities of food, education, medical treatment, recreation, cultural program and child sponsorship program. Self Help Groups, health, education, awareness camps, and socio-cultural programs are implemented by the organisation in South Parganas of West Bengal.elderlyWest BengalSponsor the nutrition and healthcare of poor senior citizens$ 12.58",+91 98744 79281,"P.O. Hotar, P.S. Magrahat,South 24 Paraganas 743610",saradarks@gmail.com,https://www.giveindia.org/nonprofit/sarada-ramkrishna-sishu-o-mahila-sevashram
133,"Sathi, Bangalore",children,Karnataka,"In 1992, an organization called Prerana had been working with farmers in North Karnataka's Raichur district. Prerana offered its office as a shelter for children, who were mostly living on Raichur railway station.Over the next 3 to 4 years, the activities with the children expanded and recreational activities were included such as picnics, skill training programs like cycle-repair, screen printing and so on. Although the attempts to place them in jobs met limited success, the engagement with children continued. After a family adopted one child, they realized that many of these children were not abandoned by their families, but had opted to 'flee' because of certain reasons (which in most cases were not very serious) without actually thinking of the consequences.The concept of 'restoration' or 'home-placement' of children thus began to take shape. Ground research revealed that the parents are also distraught when the child leaves; and they often attempt to search the child without any leads. There was a zeal within the team members to work on this issue in a dedicated manner and a new organization was carved out of Prerana. SATHI was born.Founded in 1992, SATHI was formally registered in 1997 in Raichur, Karnataka. With the growth of the organization and expansion of work, SATHI moved its head office to Bangalore. Over the years, SATHI has worked in more than 40 different locations in 14 states across India and has helped nearly 60,000 children reunite with their families.Passionate about children and their well-being, Pramod Kulkarni founded SATHI with an initial focus on providing immediate care and opportunities of resettlement for run-away children. Experience and research convinced him that run-away children could be settled back with families. An action-oriented individual, he decided to demonstrate this possibility - in large numbers and at a national scale.SATHI continued to work with Raichur as a base until the year 2000. During this phase, the work was restricted to Raichur and Wadi in Karnataka and Guntakal in Andhra Pradesh. From 2000 to 2006, the work expanded to cover other locations in Karnataka, Andhra Pradesh and Maharashtra. The year 2000 also marked the beginning of SATHI's work in Government Children Homes.The year 2006 marked a new phase in SATHI's history, when it began to expand its geographical spread across the country through collaborations with other NGOs. Between 2006 and 2010, SATHI collaborated with more than 30 different organizations and covered railway stations in 10 states including Gujarat, Rajasthan, Uttar Pradesh, Bihar, West Bengal, Delhi and Madhya Pradesh.Help reunite a runaway child with family",+91 80235 73088,"# 73, 1st Floor, ""Kamadenu"", 5th Main Road, Mathikere Extension, Bangalore, Karnataka, 560 054",shobhafernandes.sathi@gmail.com,https://www.giveindia.org/nonprofit/sathi-bangalore
134,Shramik Bharti,women,Uttar Pradesh,"Shramik Bharti is a Kanpur based NGO which works with both rural and urban communities. This includes the urban slums of Kanpur (once known as the Manchester of the East) as well as inaccessible rural areas characterised by large tracts of saline lands, ravine areas and extreme poverty. With changing economic scenarios, the sources of livelihood are getting equally affected and both urban and rural communities have poor capacities for seeking and adopting newer and additional sources of livelihood. Women and children are the worst sufferers of these inadequacies with men often migrating to alternative locations for livelihood. It is with this perspective that Shramik Bharti works for the empowerment of the poor and underprivileged with special focus on women and children. Their mission is to facilitate and foster people's democratic institutions.Help poor farmers get access to food grains for their farms and homes",+91 05122580823,"392, Vikas Nagar, Kanpur 208024Uttar Pradesh",rakesh@shramikbharti.org.in,https://www.giveindia.org/nonprofit/shramik-bharti
135,ActionAid Association,women,Delhi,"ActionAid India is part of a global federation and a full affiliate of ActionAid International that has presence in over 40 countries worldwide. Since 1972, the poor and the excluded have been at the centre of their programs in India. In 2006, they got registered as an Indian organisation called ActionAid Association. They are primarily a human rights organization. They work for the rights of disadvantaged women and children ensuring that they have good means of livelihood. ActionAid has empowered its women to take up roles in the society which till now were dominated by males, such as truck drivers, cab drivers etc. After a public hearing of a rape case in Gwalior, ActionAid set up the crisis centre in Bhopal. Gauravi is the first of its kind in India with the help of the Department of Health In 2014 to provide rights to victims of domestic and sexual abuse, belonging to vulnerable community chiefly. There are 22 Gauravi centres across the country - 3 in Madhya Pradesh, 17 in Uttar Pradesh and the most recent ones started in 2017 in Manipur and in Tuticorin. Till now, 40,000 cases have been registered in the centers. The cases that are looked into are: rape, domestic violence, molestation, minor cases, witch branding, victims of trafficking, women with mental illness, destitute women, and male or minor male victims of sexual harassment.Help an abuse victim fight for justiceR-7 Hauz Khas Enclave, New Delhi, Pincode, 110016",+91 11 40640500,"R-7 Hauz Khas Enclave, New Delhi, Pincode, 110016",Avinash.sapru@actionaid.org,https://www.giveindia.org/nonprofit/actionaid-association
136,Sikshana Foundation,education,Karnataka,"According to data, 76 percent of the rural households in India send their children to government or government-aided schools. The ASER assessment data of all Indian states submitted by the organisation Pratham states that only 40 percent of the children studying in V class in rural government schools in India can read level 2 (Class II) text and only 20 percent of them can do division. Sikshana felt the need to improve the learning levels among children studying in government school. The organisation was started by a group of like-minded professionals in the year 2002 and began its work by adopting a few government primary schools based in and around Bangalore. Today, Sikshana reaches out to children across 44,000 schools in the states of Karnataka, Andhra Pradesh, Maharashtra.Since inception, they have been working on enhancing the learning levels delivered by Govt. Schools in India with a Vision to evolve sustainable and replicable models for an effective and decentralized public school system. Their Mission is to synergize with the Government at all levels, share and transfer knowledge along with designing and implementing student centric learning experiences in the Govt. Schools.",+91 80 26629890,"41, K R Road, Basavangudi, Bangalore, 560061 Karnataka",sudeepta@sikshana.org,https://www.giveindia.org/nonprofit/sikshana-foundation
